No.     Time           Source                Destination           Protocol Length Info
      1 0.000000       192.168.0.12          224.0.0.251           MDNS     136    Standard query 0x00bf PTR _%9E5E7C8F47989526C9BCD95D24084F6F0B27C5ED._sub._googlecast._tcp.local, "QM" question PTR _googlecast._tcp.local, "QM" question

Frame 1: 136 bytes on wire (1088 bits), 136 bytes captured (1088 bits)
Ethernet II, Src: XiaomiCommun_7d:d3:21 (90:78:b2:7d:d3:21), Dst: IPv4mcast_fb (01:00:5e:00:00:fb)
Internet Protocol Version 4, Src: 192.168.0.12, Dst: 224.0.0.251
User Datagram Protocol, Src Port: 5353, Dst Port: 5353
Multicast Domain Name System (query)

No.     Time           Source                Destination           Protocol Length Info
      2 2.851691       192.168.0.13          181.30.140.196        DNS      78     Standard query 0x73c1 A mqtt-dashboard.com

Frame 2: 78 bytes on wire (624 bits), 78 bytes captured (624 bits)
Ethernet II, Src: LiteonTechno_4d:35:bf (10:63:c8:4d:35:bf), Dst: KaonGroup_51:a2:5c (90:f8:91:51:a2:5c)
Internet Protocol Version 4, Src: 192.168.0.13, Dst: 181.30.140.196
User Datagram Protocol, Src Port: 57436, Dst Port: 53
Domain Name System (query)

No.     Time           Source                Destination           Protocol Length Info
      3 2.852117       192.168.0.13          181.30.140.196        DNS      78     Standard query 0xb3c5 AAAA mqtt-dashboard.com

Frame 3: 78 bytes on wire (624 bits), 78 bytes captured (624 bits)
Ethernet II, Src: LiteonTechno_4d:35:bf (10:63:c8:4d:35:bf), Dst: KaonGroup_51:a2:5c (90:f8:91:51:a2:5c)
Internet Protocol Version 4, Src: 192.168.0.13, Dst: 181.30.140.196
User Datagram Protocol, Src Port: 57436, Dst Port: 53
Domain Name System (query)

No.     Time           Source                Destination           Protocol Length Info
      4 2.878404       181.30.140.196        192.168.0.13          DNS      110    Standard query response 0x73c1 A mqtt-dashboard.com A 3.66.109.246 A 3.77.181.188

Frame 4: 110 bytes on wire (880 bits), 110 bytes captured (880 bits)
Ethernet II, Src: KaonGroup_51:a2:5c (90:f8:91:51:a2:5c), Dst: LiteonTechno_4d:35:bf (10:63:c8:4d:35:bf)
Internet Protocol Version 4, Src: 181.30.140.196, Dst: 192.168.0.13
User Datagram Protocol, Src Port: 53, Dst Port: 57436
Domain Name System (response)

No.     Time           Source                Destination           Protocol Length Info
      5 2.878404       181.30.140.196        192.168.0.13          DNS      160    Standard query response 0xb3c5 AAAA mqtt-dashboard.com SOA ns-1309.awsdns-35.org

Frame 5: 160 bytes on wire (1280 bits), 160 bytes captured (1280 bits)
Ethernet II, Src: KaonGroup_51:a2:5c (90:f8:91:51:a2:5c), Dst: LiteonTechno_4d:35:bf (10:63:c8:4d:35:bf)
Internet Protocol Version 4, Src: 181.30.140.196, Dst: 192.168.0.13
User Datagram Protocol, Src Port: 53, Dst Port: 57436
Domain Name System (response)

No.     Time           Source                Destination           Protocol Length Info
      6 2.879415       192.168.0.13          3.66.109.246          TCP      66     63840 → 1883 [SYN] Seq=0 Win=64240 Len=0 MSS=1460 WS=256 SACK_PERM

Frame 6: 66 bytes on wire (528 bits), 66 bytes captured (528 bits)
Ethernet II, Src: LiteonTechno_4d:35:bf (10:63:c8:4d:35:bf), Dst: KaonGroup_51:a2:5c (90:f8:91:51:a2:5c)
Internet Protocol Version 4, Src: 192.168.0.13, Dst: 3.66.109.246
Transmission Control Protocol, Src Port: 63840, Dst Port: 1883, Seq: 0, Len: 0

No.     Time           Source                Destination           Protocol Length Info
      7 3.120053       3.66.109.246          192.168.0.13          TCP      66     1883 → 63840 [SYN, ACK] Seq=0 Ack=1 Win=26883 Len=0 MSS=1460 SACK_PERM WS=256

Frame 7: 66 bytes on wire (528 bits), 66 bytes captured (528 bits)
Ethernet II, Src: KaonGroup_51:a2:5c (90:f8:91:51:a2:5c), Dst: LiteonTechno_4d:35:bf (10:63:c8:4d:35:bf)
Internet Protocol Version 4, Src: 3.66.109.246, Dst: 192.168.0.13
Transmission Control Protocol, Src Port: 1883, Dst Port: 63840, Seq: 0, Ack: 1, Len: 0

No.     Time           Source                Destination           Protocol Length Info
      8 3.120229       192.168.0.13          3.66.109.246          TCP      54     63840 → 1883 [ACK] Seq=1 Ack=1 Win=131328 Len=0

Frame 8: 54 bytes on wire (432 bits), 54 bytes captured (432 bits)
Ethernet II, Src: LiteonTechno_4d:35:bf (10:63:c8:4d:35:bf), Dst: KaonGroup_51:a2:5c (90:f8:91:51:a2:5c)
Internet Protocol Version 4, Src: 192.168.0.13, Dst: 3.66.109.246
Transmission Control Protocol, Src Port: 63840, Dst Port: 1883, Seq: 1, Ack: 1, Len: 0

No.     Time           Source                Destination           Protocol Length Info
      9 3.122364       192.168.0.13          3.66.109.246          MQTT     68     Connect Command

Frame 9: 68 bytes on wire (544 bits), 68 bytes captured (544 bits)
Ethernet II, Src: LiteonTechno_4d:35:bf (10:63:c8:4d:35:bf), Dst: KaonGroup_51:a2:5c (90:f8:91:51:a2:5c)
Internet Protocol Version 4, Src: 192.168.0.13, Dst: 3.66.109.246
Transmission Control Protocol, Src Port: 63840, Dst Port: 1883, Seq: 1, Ack: 1, Len: 14
MQ Telemetry Transport Protocol, Connect Command

No.     Time           Source                Destination           Protocol Length Info
     10 3.125391       192.168.0.13          3.66.109.246          MQTT     136    Publish Message (id=1) [tp1/Videla_Spratte]

Frame 10: 136 bytes on wire (1088 bits), 136 bytes captured (1088 bits)
Ethernet II, Src: LiteonTechno_4d:35:bf (10:63:c8:4d:35:bf), Dst: KaonGroup_51:a2:5c (90:f8:91:51:a2:5c)
Internet Protocol Version 4, Src: 192.168.0.13, Dst: 3.66.109.246
Transmission Control Protocol, Src Port: 63840, Dst Port: 1883, Seq: 15, Ack: 1, Len: 82
MQ Telemetry Transport Protocol, Publish Message

No.     Time           Source                Destination           Protocol Length Info
     11 3.267280       34.120.52.64          192.168.0.13          TLSv1.2  81     Application Data

Frame 11: 81 bytes on wire (648 bits), 81 bytes captured (648 bits)
Ethernet II, Src: KaonGroup_51:a2:5c (90:f8:91:51:a2:5c), Dst: LiteonTechno_4d:35:bf (10:63:c8:4d:35:bf)
Internet Protocol Version 4, Src: 34.120.52.64, Dst: 192.168.0.13
Transmission Control Protocol, Src Port: 443, Dst Port: 62244, Seq: 1, Ack: 1, Len: 27
Transport Layer Security

No.     Time           Source                Destination           Protocol Length Info
     12 3.267879       192.168.0.13          34.120.52.64          TLSv1.2  85     Application Data

Frame 12: 85 bytes on wire (680 bits), 85 bytes captured (680 bits)
Ethernet II, Src: LiteonTechno_4d:35:bf (10:63:c8:4d:35:bf), Dst: KaonGroup_51:a2:5c (90:f8:91:51:a2:5c)
Internet Protocol Version 4, Src: 192.168.0.13, Dst: 34.120.52.64
Transmission Control Protocol, Src Port: 62244, Dst Port: 443, Seq: 1, Ack: 28, Len: 31
Transport Layer Security

No.     Time           Source                Destination           Protocol Length Info
     13 3.289605       34.120.52.64          192.168.0.13          TCP      60     443 → 62244 [ACK] Seq=28 Ack=32 Win=1043 Len=0

Frame 13: 60 bytes on wire (480 bits), 60 bytes captured (480 bits)
Ethernet II, Src: KaonGroup_51:a2:5c (90:f8:91:51:a2:5c), Dst: LiteonTechno_4d:35:bf (10:63:c8:4d:35:bf)
Internet Protocol Version 4, Src: 34.120.52.64, Dst: 192.168.0.13
Transmission Control Protocol, Src Port: 443, Dst Port: 62244, Seq: 28, Ack: 32, Len: 0

No.     Time           Source                Destination           Protocol Length Info
     14 3.358235       3.66.109.246          192.168.0.13          TCP      60     1883 → 63840 [ACK] Seq=1 Ack=15 Win=27136 Len=0

Frame 14: 60 bytes on wire (480 bits), 60 bytes captured (480 bits)
Ethernet II, Src: KaonGroup_51:a2:5c (90:f8:91:51:a2:5c), Dst: LiteonTechno_4d:35:bf (10:63:c8:4d:35:bf)
Internet Protocol Version 4, Src: 3.66.109.246, Dst: 192.168.0.13
Transmission Control Protocol, Src Port: 1883, Dst Port: 63840, Seq: 1, Ack: 15, Len: 0

No.     Time           Source                Destination           Protocol Length Info
     15 3.358235       3.66.109.246          192.168.0.13          TCP      60     1883 → 63840 [ACK] Seq=1 Ack=97 Win=27136 Len=0

Frame 15: 60 bytes on wire (480 bits), 60 bytes captured (480 bits)
Ethernet II, Src: KaonGroup_51:a2:5c (90:f8:91:51:a2:5c), Dst: LiteonTechno_4d:35:bf (10:63:c8:4d:35:bf)
Internet Protocol Version 4, Src: 3.66.109.246, Dst: 192.168.0.13
Transmission Control Protocol, Src Port: 1883, Dst Port: 63840, Seq: 1, Ack: 97, Len: 0

No.     Time           Source                Destination           Protocol Length Info
     16 3.368361       3.66.109.246          192.168.0.13          MQTT     60     Connect Ack

Frame 16: 60 bytes on wire (480 bits), 60 bytes captured (480 bits)
Ethernet II, Src: KaonGroup_51:a2:5c (90:f8:91:51:a2:5c), Dst: LiteonTechno_4d:35:bf (10:63:c8:4d:35:bf)
Internet Protocol Version 4, Src: 3.66.109.246, Dst: 192.168.0.13
Transmission Control Protocol, Src Port: 1883, Dst Port: 63840, Seq: 1, Ack: 97, Len: 4
MQ Telemetry Transport Protocol, Connect Ack

No.     Time           Source                Destination           Protocol Length Info
     17 3.393437       3.66.109.246          192.168.0.13          MQTT     136    Publish Message (id=51) [tp1/Videla_Spratte]

Frame 17: 136 bytes on wire (1088 bits), 136 bytes captured (1088 bits)
Ethernet II, Src: KaonGroup_51:a2:5c (90:f8:91:51:a2:5c), Dst: LiteonTechno_4d:35:bf (10:63:c8:4d:35:bf)
Internet Protocol Version 4, Src: 3.66.109.246, Dst: 192.168.0.13
Transmission Control Protocol, Src Port: 1883, Dst Port: 63795, Seq: 1, Ack: 1, Len: 82
MQ Telemetry Transport Protocol, Publish Message

No.     Time           Source                Destination           Protocol Length Info
     18 3.393437       3.66.109.246          192.168.0.13          MQTT     60     Publish Received (id=1)

Frame 18: 60 bytes on wire (480 bits), 60 bytes captured (480 bits)
Ethernet II, Src: KaonGroup_51:a2:5c (90:f8:91:51:a2:5c), Dst: LiteonTechno_4d:35:bf (10:63:c8:4d:35:bf)
Internet Protocol Version 4, Src: 3.66.109.246, Dst: 192.168.0.13
Transmission Control Protocol, Src Port: 1883, Dst Port: 63840, Seq: 5, Ack: 97, Len: 4
MQ Telemetry Transport Protocol, Publish Received

No.     Time           Source                Destination           Protocol Length Info
     19 3.393550       192.168.0.13          3.66.109.246          TCP      54     63840 → 1883 [ACK] Seq=97 Ack=9 Win=131328 Len=0

Frame 19: 54 bytes on wire (432 bits), 54 bytes captured (432 bits)
Ethernet II, Src: LiteonTechno_4d:35:bf (10:63:c8:4d:35:bf), Dst: KaonGroup_51:a2:5c (90:f8:91:51:a2:5c)
Internet Protocol Version 4, Src: 192.168.0.13, Dst: 3.66.109.246
Transmission Control Protocol, Src Port: 63840, Dst Port: 1883, Seq: 97, Ack: 9, Len: 0

No.     Time           Source                Destination           Protocol Length Info
     20 3.394762       192.168.0.13          3.66.109.246          MQTT     58     Publish Received (id=51)

Frame 20: 58 bytes on wire (464 bits), 58 bytes captured (464 bits)
Ethernet II, Src: LiteonTechno_4d:35:bf (10:63:c8:4d:35:bf), Dst: KaonGroup_51:a2:5c (90:f8:91:51:a2:5c)
Internet Protocol Version 4, Src: 192.168.0.13, Dst: 3.66.109.246
Transmission Control Protocol, Src Port: 63795, Dst Port: 1883, Seq: 1, Ack: 83, Len: 4
MQ Telemetry Transport Protocol, Publish Received

No.     Time           Source                Destination           Protocol Length Info
     21 3.649886       3.66.109.246          192.168.0.13          MQTT     60     Publish Release (id=51)

Frame 21: 60 bytes on wire (480 bits), 60 bytes captured (480 bits)
Ethernet II, Src: KaonGroup_51:a2:5c (90:f8:91:51:a2:5c), Dst: LiteonTechno_4d:35:bf (10:63:c8:4d:35:bf)
Internet Protocol Version 4, Src: 3.66.109.246, Dst: 192.168.0.13
Transmission Control Protocol, Src Port: 1883, Dst Port: 63795, Seq: 83, Ack: 5, Len: 4
MQ Telemetry Transport Protocol, Publish Release

No.     Time           Source                Destination           Protocol Length Info
     22 3.651919       192.168.0.13          3.66.109.246          MQTT     58     Publish Complete (id=51)

Frame 22: 58 bytes on wire (464 bits), 58 bytes captured (464 bits)
Ethernet II, Src: LiteonTechno_4d:35:bf (10:63:c8:4d:35:bf), Dst: KaonGroup_51:a2:5c (90:f8:91:51:a2:5c)
Internet Protocol Version 4, Src: 192.168.0.13, Dst: 3.66.109.246
Transmission Control Protocol, Src Port: 63795, Dst Port: 1883, Seq: 5, Ack: 87, Len: 4
MQ Telemetry Transport Protocol, Publish Complete

No.     Time           Source                Destination           Protocol Length Info
     23 3.794047       192.168.0.13          162.159.136.234       TLSv1.2  108    Application Data

Frame 23: 108 bytes on wire (864 bits), 108 bytes captured (864 bits)
Ethernet II, Src: LiteonTechno_4d:35:bf (10:63:c8:4d:35:bf), Dst: KaonGroup_51:a2:5c (90:f8:91:51:a2:5c)
Internet Protocol Version 4, Src: 192.168.0.13, Dst: 162.159.136.234
Transmission Control Protocol, Src Port: 62329, Dst Port: 443, Seq: 1, Ack: 1, Len: 54
Transport Layer Security

No.     Time           Source                Destination           Protocol Length Info
     24 3.818628       162.159.136.234       192.168.0.13          TCP      60     443 → 62329 [ACK] Seq=1 Ack=55 Win=10 Len=0

Frame 24: 60 bytes on wire (480 bits), 60 bytes captured (480 bits)
Ethernet II, Src: KaonGroup_51:a2:5c (90:f8:91:51:a2:5c), Dst: LiteonTechno_4d:35:bf (10:63:c8:4d:35:bf)
Internet Protocol Version 4, Src: 162.159.136.234, Dst: 192.168.0.13
Transmission Control Protocol, Src Port: 443, Dst Port: 62329, Seq: 1, Ack: 55, Len: 0

No.     Time           Source                Destination           Protocol Length Info
     25 3.941655       3.66.109.246          192.168.0.13          TCP      60     1883 → 63795 [ACK] Seq=87 Ack=9 Win=106 Len=0

Frame 25: 60 bytes on wire (480 bits), 60 bytes captured (480 bits)
Ethernet II, Src: KaonGroup_51:a2:5c (90:f8:91:51:a2:5c), Dst: LiteonTechno_4d:35:bf (10:63:c8:4d:35:bf)
Internet Protocol Version 4, Src: 3.66.109.246, Dst: 192.168.0.13
Transmission Control Protocol, Src Port: 1883, Dst Port: 63795, Seq: 87, Ack: 9, Len: 0

No.     Time           Source                Destination           Protocol Length Info
     26 3.950539       162.159.136.234       192.168.0.13          TLSv1.2  88     Application Data

Frame 26: 88 bytes on wire (704 bits), 88 bytes captured (704 bits)
Ethernet II, Src: KaonGroup_51:a2:5c (90:f8:91:51:a2:5c), Dst: LiteonTechno_4d:35:bf (10:63:c8:4d:35:bf)
Internet Protocol Version 4, Src: 162.159.136.234, Dst: 192.168.0.13
Transmission Control Protocol, Src Port: 443, Dst Port: 62329, Seq: 1, Ack: 55, Len: 34
Transport Layer Security

No.     Time           Source                Destination           Protocol Length Info
     27 3.990321       192.168.0.13          162.159.136.234       TCP      54     62329 → 443 [ACK] Seq=55 Ack=35 Win=511 Len=0

Frame 27: 54 bytes on wire (432 bits), 54 bytes captured (432 bits)
Ethernet II, Src: LiteonTechno_4d:35:bf (10:63:c8:4d:35:bf), Dst: KaonGroup_51:a2:5c (90:f8:91:51:a2:5c)
Internet Protocol Version 4, Src: 192.168.0.13, Dst: 162.159.136.234
Transmission Control Protocol, Src Port: 62329, Dst Port: 443, Seq: 55, Ack: 35, Len: 0

No.     Time           Source                Destination           Protocol Length Info
     28 4.128602       192.168.0.13          3.66.109.246          MQTT     143    Publish Message (id=2) [tp1/Videla_Spratte]

Frame 28: 143 bytes on wire (1144 bits), 143 bytes captured (1144 bits)
Ethernet II, Src: LiteonTechno_4d:35:bf (10:63:c8:4d:35:bf), Dst: KaonGroup_51:a2:5c (90:f8:91:51:a2:5c)
Internet Protocol Version 4, Src: 192.168.0.13, Dst: 3.66.109.246
Transmission Control Protocol, Src Port: 63840, Dst Port: 1883, Seq: 97, Ack: 9, Len: 89
MQ Telemetry Transport Protocol, Publish Message

No.     Time           Source                Destination           Protocol Length Info
     29 4.295576       192.168.0.13          172.172.255.217       TCP      55     65512 → 443 [ACK] Seq=1 Ack=1 Win=512 Len=1

Frame 29: 55 bytes on wire (440 bits), 55 bytes captured (440 bits)
Ethernet II, Src: LiteonTechno_4d:35:bf (10:63:c8:4d:35:bf), Dst: KaonGroup_51:a2:5c (90:f8:91:51:a2:5c)
Internet Protocol Version 4, Src: 192.168.0.13, Dst: 172.172.255.217
Transmission Control Protocol, Src Port: 65512, Dst Port: 443, Seq: 1, Ack: 1, Len: 1

No.     Time           Source                Destination           Protocol Length Info
     30 4.376263       3.66.109.246          192.168.0.13          MQTT     60     Publish Received (id=2)

Frame 30: 60 bytes on wire (480 bits), 60 bytes captured (480 bits)
Ethernet II, Src: KaonGroup_51:a2:5c (90:f8:91:51:a2:5c), Dst: LiteonTechno_4d:35:bf (10:63:c8:4d:35:bf)
Internet Protocol Version 4, Src: 3.66.109.246, Dst: 192.168.0.13
Transmission Control Protocol, Src Port: 1883, Dst Port: 63840, Seq: 9, Ack: 186, Len: 4
MQ Telemetry Transport Protocol, Publish Received

No.     Time           Source                Destination           Protocol Length Info
     31 4.376263       3.66.109.246          192.168.0.13          MQTT     143    Publish Message (id=101) [tp1/Videla_Spratte]

Frame 31: 143 bytes on wire (1144 bits), 143 bytes captured (1144 bits)
Ethernet II, Src: KaonGroup_51:a2:5c (90:f8:91:51:a2:5c), Dst: LiteonTechno_4d:35:bf (10:63:c8:4d:35:bf)
Internet Protocol Version 4, Src: 3.66.109.246, Dst: 192.168.0.13
Transmission Control Protocol, Src Port: 1883, Dst Port: 63795, Seq: 87, Ack: 9, Len: 89
MQ Telemetry Transport Protocol, Publish Message

No.     Time           Source                Destination           Protocol Length Info
     32 4.378084       192.168.0.13          3.66.109.246          MQTT     58     Publish Received (id=101)

Frame 32: 58 bytes on wire (464 bits), 58 bytes captured (464 bits)
Ethernet II, Src: LiteonTechno_4d:35:bf (10:63:c8:4d:35:bf), Dst: KaonGroup_51:a2:5c (90:f8:91:51:a2:5c)
Internet Protocol Version 4, Src: 192.168.0.13, Dst: 3.66.109.246
Transmission Control Protocol, Src Port: 63795, Dst Port: 1883, Seq: 9, Ack: 176, Len: 4
MQ Telemetry Transport Protocol, Publish Received

No.     Time           Source                Destination           Protocol Length Info
     33 4.421539       192.168.0.13          3.66.109.246          TCP      54     63840 → 1883 [ACK] Seq=186 Ack=13 Win=131328 Len=0

Frame 33: 54 bytes on wire (432 bits), 54 bytes captured (432 bits)
Ethernet II, Src: LiteonTechno_4d:35:bf (10:63:c8:4d:35:bf), Dst: KaonGroup_51:a2:5c (90:f8:91:51:a2:5c)
Internet Protocol Version 4, Src: 192.168.0.13, Dst: 3.66.109.246
Transmission Control Protocol, Src Port: 63840, Dst Port: 1883, Seq: 186, Ack: 13, Len: 0

No.     Time           Source                Destination           Protocol Length Info
     34 4.458388       172.172.255.217       192.168.0.13          TCP      66     443 → 65512 [ACK] Seq=1 Ack=2 Win=7883 Len=0 SLE=1 SRE=2

Frame 34: 66 bytes on wire (528 bits), 66 bytes captured (528 bits)
Ethernet II, Src: KaonGroup_51:a2:5c (90:f8:91:51:a2:5c), Dst: LiteonTechno_4d:35:bf (10:63:c8:4d:35:bf)
Internet Protocol Version 4, Src: 172.172.255.217, Dst: 192.168.0.13
Transmission Control Protocol, Src Port: 443, Dst Port: 65512, Seq: 1, Ack: 2, Len: 0

No.     Time           Source                Destination           Protocol Length Info
     35 4.627427       3.66.109.246          192.168.0.13          TCP      60     1883 → 63795 [ACK] Seq=176 Ack=13 Win=106 Len=0

Frame 35: 60 bytes on wire (480 bits), 60 bytes captured (480 bits)
Ethernet II, Src: KaonGroup_51:a2:5c (90:f8:91:51:a2:5c), Dst: LiteonTechno_4d:35:bf (10:63:c8:4d:35:bf)
Internet Protocol Version 4, Src: 3.66.109.246, Dst: 192.168.0.13
Transmission Control Protocol, Src Port: 1883, Dst Port: 63795, Seq: 176, Ack: 13, Len: 0

No.     Time           Source                Destination           Protocol Length Info
     36 4.627427       3.66.109.246          192.168.0.13          MQTT     60     Publish Release (id=101)

Frame 36: 60 bytes on wire (480 bits), 60 bytes captured (480 bits)
Ethernet II, Src: KaonGroup_51:a2:5c (90:f8:91:51:a2:5c), Dst: LiteonTechno_4d:35:bf (10:63:c8:4d:35:bf)
Internet Protocol Version 4, Src: 3.66.109.246, Dst: 192.168.0.13
Transmission Control Protocol, Src Port: 1883, Dst Port: 63795, Seq: 176, Ack: 13, Len: 4
MQ Telemetry Transport Protocol, Publish Release

No.     Time           Source                Destination           Protocol Length Info
     37 4.631836       192.168.0.13          3.66.109.246          MQTT     58     Publish Complete (id=101)

Frame 37: 58 bytes on wire (464 bits), 58 bytes captured (464 bits)
Ethernet II, Src: LiteonTechno_4d:35:bf (10:63:c8:4d:35:bf), Dst: KaonGroup_51:a2:5c (90:f8:91:51:a2:5c)
Internet Protocol Version 4, Src: 192.168.0.13, Dst: 3.66.109.246
Transmission Control Protocol, Src Port: 63795, Dst Port: 1883, Seq: 13, Ack: 180, Len: 4
MQ Telemetry Transport Protocol, Publish Complete

No.     Time           Source                Destination           Protocol Length Info
     38 4.921673       3.66.109.246          192.168.0.13          TCP      60     1883 → 63795 [ACK] Seq=180 Ack=17 Win=106 Len=0

Frame 38: 60 bytes on wire (480 bits), 60 bytes captured (480 bits)
Ethernet II, Src: KaonGroup_51:a2:5c (90:f8:91:51:a2:5c), Dst: LiteonTechno_4d:35:bf (10:63:c8:4d:35:bf)
Internet Protocol Version 4, Src: 3.66.109.246, Dst: 192.168.0.13
Transmission Control Protocol, Src Port: 1883, Dst Port: 63795, Seq: 180, Ack: 17, Len: 0

No.     Time           Source                Destination           Protocol Length Info
     39 5.132136       192.168.0.13          3.66.109.246          MQTT     139    Publish Message (id=3) [tp1/Videla_Spratte]

Frame 39: 139 bytes on wire (1112 bits), 139 bytes captured (1112 bits)
Ethernet II, Src: LiteonTechno_4d:35:bf (10:63:c8:4d:35:bf), Dst: KaonGroup_51:a2:5c (90:f8:91:51:a2:5c)
Internet Protocol Version 4, Src: 192.168.0.13, Dst: 3.66.109.246
Transmission Control Protocol, Src Port: 63840, Dst Port: 1883, Seq: 186, Ack: 13, Len: 85
MQ Telemetry Transport Protocol, Publish Message

No.     Time           Source                Destination           Protocol Length Info
     40 5.378854       3.66.109.246          192.168.0.13          MQTT     139    Publish Message (id=151) [tp1/Videla_Spratte]

Frame 40: 139 bytes on wire (1112 bits), 139 bytes captured (1112 bits)
Ethernet II, Src: KaonGroup_51:a2:5c (90:f8:91:51:a2:5c), Dst: LiteonTechno_4d:35:bf (10:63:c8:4d:35:bf)
Internet Protocol Version 4, Src: 3.66.109.246, Dst: 192.168.0.13
Transmission Control Protocol, Src Port: 1883, Dst Port: 63795, Seq: 180, Ack: 17, Len: 85
MQ Telemetry Transport Protocol, Publish Message

No.     Time           Source                Destination           Protocol Length Info
     41 5.378854       3.66.109.246          192.168.0.13          MQTT     60     Publish Received (id=3)

Frame 41: 60 bytes on wire (480 bits), 60 bytes captured (480 bits)
Ethernet II, Src: KaonGroup_51:a2:5c (90:f8:91:51:a2:5c), Dst: LiteonTechno_4d:35:bf (10:63:c8:4d:35:bf)
Internet Protocol Version 4, Src: 3.66.109.246, Dst: 192.168.0.13
Transmission Control Protocol, Src Port: 1883, Dst Port: 63840, Seq: 13, Ack: 271, Len: 4
MQ Telemetry Transport Protocol, Publish Received

No.     Time           Source                Destination           Protocol Length Info
     42 5.380668       192.168.0.13          3.66.109.246          MQTT     58     Publish Received (id=151)

Frame 42: 58 bytes on wire (464 bits), 58 bytes captured (464 bits)
Ethernet II, Src: LiteonTechno_4d:35:bf (10:63:c8:4d:35:bf), Dst: KaonGroup_51:a2:5c (90:f8:91:51:a2:5c)
Internet Protocol Version 4, Src: 192.168.0.13, Dst: 3.66.109.246
Transmission Control Protocol, Src Port: 63795, Dst Port: 1883, Seq: 17, Ack: 265, Len: 4
MQ Telemetry Transport Protocol, Publish Received

No.     Time           Source                Destination           Protocol Length Info
     43 5.418806       192.168.0.13          3.66.109.246          TCP      54     63840 → 1883 [ACK] Seq=271 Ack=17 Win=131328 Len=0

Frame 43: 54 bytes on wire (432 bits), 54 bytes captured (432 bits)
Ethernet II, Src: LiteonTechno_4d:35:bf (10:63:c8:4d:35:bf), Dst: KaonGroup_51:a2:5c (90:f8:91:51:a2:5c)
Internet Protocol Version 4, Src: 192.168.0.13, Dst: 3.66.109.246
Transmission Control Protocol, Src Port: 63840, Dst Port: 1883, Seq: 271, Ack: 17, Len: 0

No.     Time           Source                Destination           Protocol Length Info
     44 5.495899       192.168.0.13          142.250.0.188         TCP      55     61562 → 5228 [ACK] Seq=1 Ack=1 Win=507 Len=1

Frame 44: 55 bytes on wire (440 bits), 55 bytes captured (440 bits)
Ethernet II, Src: LiteonTechno_4d:35:bf (10:63:c8:4d:35:bf), Dst: KaonGroup_51:a2:5c (90:f8:91:51:a2:5c)
Internet Protocol Version 4, Src: 192.168.0.13, Dst: 142.250.0.188
Transmission Control Protocol, Src Port: 61562, Dst Port: 5228, Seq: 1, Ack: 1, Len: 1
Data (1 byte)

0000  00                                                .

No.     Time           Source                Destination           Protocol Length Info
     45 5.631067       3.66.109.246          192.168.0.13          TCP      60     1883 → 63795 [ACK] Seq=265 Ack=21 Win=106 Len=0

Frame 45: 60 bytes on wire (480 bits), 60 bytes captured (480 bits)
Ethernet II, Src: KaonGroup_51:a2:5c (90:f8:91:51:a2:5c), Dst: LiteonTechno_4d:35:bf (10:63:c8:4d:35:bf)
Internet Protocol Version 4, Src: 3.66.109.246, Dst: 192.168.0.13
Transmission Control Protocol, Src Port: 1883, Dst Port: 63795, Seq: 265, Ack: 21, Len: 0

No.     Time           Source                Destination           Protocol Length Info
     46 5.710922       3.66.109.246          192.168.0.13          MQTT     60     Publish Release (id=151)

Frame 46: 60 bytes on wire (480 bits), 60 bytes captured (480 bits)
Ethernet II, Src: KaonGroup_51:a2:5c (90:f8:91:51:a2:5c), Dst: LiteonTechno_4d:35:bf (10:63:c8:4d:35:bf)
Internet Protocol Version 4, Src: 3.66.109.246, Dst: 192.168.0.13
Transmission Control Protocol, Src Port: 1883, Dst Port: 63795, Seq: 265, Ack: 21, Len: 4
MQ Telemetry Transport Protocol, Publish Release

No.     Time           Source                Destination           Protocol Length Info
     47 5.712241       192.168.0.13          3.66.109.246          MQTT     58     Publish Complete (id=151)

Frame 47: 58 bytes on wire (464 bits), 58 bytes captured (464 bits)
Ethernet II, Src: LiteonTechno_4d:35:bf (10:63:c8:4d:35:bf), Dst: KaonGroup_51:a2:5c (90:f8:91:51:a2:5c)
Internet Protocol Version 4, Src: 192.168.0.13, Dst: 3.66.109.246
Transmission Control Protocol, Src Port: 63795, Dst Port: 1883, Seq: 21, Ack: 269, Len: 4
MQ Telemetry Transport Protocol, Publish Complete

No.     Time           Source                Destination           Protocol Length Info
     48 5.960428       3.66.109.246          192.168.0.13          TCP      60     1883 → 63795 [ACK] Seq=269 Ack=25 Win=106 Len=0

Frame 48: 60 bytes on wire (480 bits), 60 bytes captured (480 bits)
Ethernet II, Src: KaonGroup_51:a2:5c (90:f8:91:51:a2:5c), Dst: LiteonTechno_4d:35:bf (10:63:c8:4d:35:bf)
Internet Protocol Version 4, Src: 3.66.109.246, Dst: 192.168.0.13
Transmission Control Protocol, Src Port: 1883, Dst Port: 63795, Seq: 269, Ack: 25, Len: 0

No.     Time           Source                Destination           Protocol Length Info
     49 6.136263       192.168.0.13          3.66.109.246          MQTT     151    Publish Message (id=4) [tp1/Videla_Spratte]

Frame 49: 151 bytes on wire (1208 bits), 151 bytes captured (1208 bits)
Ethernet II, Src: LiteonTechno_4d:35:bf (10:63:c8:4d:35:bf), Dst: KaonGroup_51:a2:5c (90:f8:91:51:a2:5c)
Internet Protocol Version 4, Src: 192.168.0.13, Dst: 3.66.109.246
Transmission Control Protocol, Src Port: 63840, Dst Port: 1883, Seq: 271, Ack: 17, Len: 97
MQ Telemetry Transport Protocol, Publish Message

No.     Time           Source                Destination           Protocol Length Info
     50 6.248542       192.168.0.13          142.251.0.188         TCP      55     63834 → 5228 [ACK] Seq=1 Ack=1 Win=510 Len=1

Frame 50: 55 bytes on wire (440 bits), 55 bytes captured (440 bits)
Ethernet II, Src: LiteonTechno_4d:35:bf (10:63:c8:4d:35:bf), Dst: KaonGroup_51:a2:5c (90:f8:91:51:a2:5c)
Internet Protocol Version 4, Src: 192.168.0.13, Dst: 142.251.0.188
Transmission Control Protocol, Src Port: 63834, Dst Port: 5228, Seq: 1, Ack: 1, Len: 1
Data (1 byte)

0000  00                                                .

No.     Time           Source                Destination           Protocol Length Info
     51 6.292061       142.251.0.188         192.168.0.13          TCP      66     5228 → 63834 [ACK] Seq=1 Ack=2 Win=290 Len=0 SLE=1 SRE=2

Frame 51: 66 bytes on wire (528 bits), 66 bytes captured (528 bits)
Ethernet II, Src: KaonGroup_51:a2:5c (90:f8:91:51:a2:5c), Dst: LiteonTechno_4d:35:bf (10:63:c8:4d:35:bf)
Internet Protocol Version 4, Src: 142.251.0.188, Dst: 192.168.0.13
Transmission Control Protocol, Src Port: 5228, Dst Port: 63834, Seq: 1, Ack: 2, Len: 0

No.     Time           Source                Destination           Protocol Length Info
     52 6.384462       3.66.109.246          192.168.0.13          MQTT     60     Publish Received (id=4)

Frame 52: 60 bytes on wire (480 bits), 60 bytes captured (480 bits)
Ethernet II, Src: KaonGroup_51:a2:5c (90:f8:91:51:a2:5c), Dst: LiteonTechno_4d:35:bf (10:63:c8:4d:35:bf)
Internet Protocol Version 4, Src: 3.66.109.246, Dst: 192.168.0.13
Transmission Control Protocol, Src Port: 1883, Dst Port: 63840, Seq: 17, Ack: 368, Len: 4
MQ Telemetry Transport Protocol, Publish Received

No.     Time           Source                Destination           Protocol Length Info
     53 6.384462       3.66.109.246          192.168.0.13          MQTT     151    Publish Message (id=201) [tp1/Videla_Spratte]

Frame 53: 151 bytes on wire (1208 bits), 151 bytes captured (1208 bits)
Ethernet II, Src: KaonGroup_51:a2:5c (90:f8:91:51:a2:5c), Dst: LiteonTechno_4d:35:bf (10:63:c8:4d:35:bf)
Internet Protocol Version 4, Src: 3.66.109.246, Dst: 192.168.0.13
Transmission Control Protocol, Src Port: 1883, Dst Port: 63795, Seq: 269, Ack: 25, Len: 97
MQ Telemetry Transport Protocol, Publish Message

No.     Time           Source                Destination           Protocol Length Info
     54 6.386111       192.168.0.13          3.66.109.246          MQTT     58     Publish Received (id=201)

Frame 54: 58 bytes on wire (464 bits), 58 bytes captured (464 bits)
Ethernet II, Src: LiteonTechno_4d:35:bf (10:63:c8:4d:35:bf), Dst: KaonGroup_51:a2:5c (90:f8:91:51:a2:5c)
Internet Protocol Version 4, Src: 192.168.0.13, Dst: 3.66.109.246
Transmission Control Protocol, Src Port: 63795, Dst Port: 1883, Seq: 25, Ack: 366, Len: 4
MQ Telemetry Transport Protocol, Publish Received

No.     Time           Source                Destination           Protocol Length Info
     55 6.425033       192.168.0.13          3.66.109.246          TCP      54     63840 → 1883 [ACK] Seq=368 Ack=21 Win=131328 Len=0

Frame 55: 54 bytes on wire (432 bits), 54 bytes captured (432 bits)
Ethernet II, Src: LiteonTechno_4d:35:bf (10:63:c8:4d:35:bf), Dst: KaonGroup_51:a2:5c (90:f8:91:51:a2:5c)
Internet Protocol Version 4, Src: 192.168.0.13, Dst: 3.66.109.246
Transmission Control Protocol, Src Port: 63840, Dst Port: 1883, Seq: 368, Ack: 21, Len: 0

No.     Time           Source                Destination           Protocol Length Info
     56 6.634123       3.66.109.246          192.168.0.13          TCP      60     1883 → 63795 [ACK] Seq=366 Ack=29 Win=106 Len=0

Frame 56: 60 bytes on wire (480 bits), 60 bytes captured (480 bits)
Ethernet II, Src: KaonGroup_51:a2:5c (90:f8:91:51:a2:5c), Dst: LiteonTechno_4d:35:bf (10:63:c8:4d:35:bf)
Internet Protocol Version 4, Src: 3.66.109.246, Dst: 192.168.0.13
Transmission Control Protocol, Src Port: 1883, Dst Port: 63795, Seq: 366, Ack: 29, Len: 0

No.     Time           Source                Destination           Protocol Length Info
     57 6.681764       3.66.109.246          192.168.0.13          MQTT     60     Publish Release (id=201)

Frame 57: 60 bytes on wire (480 bits), 60 bytes captured (480 bits)
Ethernet II, Src: KaonGroup_51:a2:5c (90:f8:91:51:a2:5c), Dst: LiteonTechno_4d:35:bf (10:63:c8:4d:35:bf)
Internet Protocol Version 4, Src: 3.66.109.246, Dst: 192.168.0.13
Transmission Control Protocol, Src Port: 1883, Dst Port: 63795, Seq: 366, Ack: 29, Len: 4
MQ Telemetry Transport Protocol, Publish Release

No.     Time           Source                Destination           Protocol Length Info
     58 6.683225       192.168.0.13          3.66.109.246          MQTT     58     Publish Complete (id=201)

Frame 58: 58 bytes on wire (464 bits), 58 bytes captured (464 bits)
Ethernet II, Src: LiteonTechno_4d:35:bf (10:63:c8:4d:35:bf), Dst: KaonGroup_51:a2:5c (90:f8:91:51:a2:5c)
Internet Protocol Version 4, Src: 192.168.0.13, Dst: 3.66.109.246
Transmission Control Protocol, Src Port: 63795, Dst Port: 1883, Seq: 29, Ack: 370, Len: 4
MQ Telemetry Transport Protocol, Publish Complete

No.     Time           Source                Destination           Protocol Length Info
     59 6.930580       3.66.109.246          192.168.0.13          TCP      60     1883 → 63795 [ACK] Seq=370 Ack=33 Win=106 Len=0

Frame 59: 60 bytes on wire (480 bits), 60 bytes captured (480 bits)
Ethernet II, Src: KaonGroup_51:a2:5c (90:f8:91:51:a2:5c), Dst: LiteonTechno_4d:35:bf (10:63:c8:4d:35:bf)
Internet Protocol Version 4, Src: 3.66.109.246, Dst: 192.168.0.13
Transmission Control Protocol, Src Port: 1883, Dst Port: 63795, Seq: 370, Ack: 33, Len: 0

No.     Time           Source                Destination           Protocol Length Info
     60 7.140320       192.168.0.13          3.66.109.246          MQTT     138    Publish Message (id=5) [tp1/Videla_Spratte]

Frame 60: 138 bytes on wire (1104 bits), 138 bytes captured (1104 bits)
Ethernet II, Src: LiteonTechno_4d:35:bf (10:63:c8:4d:35:bf), Dst: KaonGroup_51:a2:5c (90:f8:91:51:a2:5c)
Internet Protocol Version 4, Src: 192.168.0.13, Dst: 3.66.109.246
Transmission Control Protocol, Src Port: 63840, Dst Port: 1883, Seq: 368, Ack: 21, Len: 84
MQ Telemetry Transport Protocol, Publish Message

No.     Time           Source                Destination           Protocol Length Info
     61 7.423100       3.66.109.246          192.168.0.13          TCP      60     1883 → 63840 [ACK] Seq=21 Ack=452 Win=27136 Len=0

Frame 61: 60 bytes on wire (480 bits), 60 bytes captured (480 bits)
Ethernet II, Src: KaonGroup_51:a2:5c (90:f8:91:51:a2:5c), Dst: LiteonTechno_4d:35:bf (10:63:c8:4d:35:bf)
Internet Protocol Version 4, Src: 3.66.109.246, Dst: 192.168.0.13
Transmission Control Protocol, Src Port: 1883, Dst Port: 63840, Seq: 21, Ack: 452, Len: 0

No.     Time           Source                Destination           Protocol Length Info
     62 7.451799       3.66.109.246          192.168.0.13          MQTT     138    Publish Message (id=251) [tp1/Videla_Spratte]

Frame 62: 138 bytes on wire (1104 bits), 138 bytes captured (1104 bits)
Ethernet II, Src: KaonGroup_51:a2:5c (90:f8:91:51:a2:5c), Dst: LiteonTechno_4d:35:bf (10:63:c8:4d:35:bf)
Internet Protocol Version 4, Src: 3.66.109.246, Dst: 192.168.0.13
Transmission Control Protocol, Src Port: 1883, Dst Port: 63795, Seq: 370, Ack: 33, Len: 84
MQ Telemetry Transport Protocol, Publish Message

No.     Time           Source                Destination           Protocol Length Info
     63 7.452586       192.168.0.13          3.66.109.246          MQTT     58     Publish Received (id=251)

Frame 63: 58 bytes on wire (464 bits), 58 bytes captured (464 bits)
Ethernet II, Src: LiteonTechno_4d:35:bf (10:63:c8:4d:35:bf), Dst: KaonGroup_51:a2:5c (90:f8:91:51:a2:5c)
Internet Protocol Version 4, Src: 192.168.0.13, Dst: 3.66.109.246
Transmission Control Protocol, Src Port: 63795, Dst Port: 1883, Seq: 33, Ack: 454, Len: 4
MQ Telemetry Transport Protocol, Publish Received

No.     Time           Source                Destination           Protocol Length Info
     64 7.486190       3.66.109.246          192.168.0.13          MQTT     60     Publish Received (id=5)

Frame 64: 60 bytes on wire (480 bits), 60 bytes captured (480 bits)
Ethernet II, Src: KaonGroup_51:a2:5c (90:f8:91:51:a2:5c), Dst: LiteonTechno_4d:35:bf (10:63:c8:4d:35:bf)
Internet Protocol Version 4, Src: 3.66.109.246, Dst: 192.168.0.13
Transmission Control Protocol, Src Port: 1883, Dst Port: 63840, Seq: 21, Ack: 452, Len: 4
MQ Telemetry Transport Protocol, Publish Received

No.     Time           Source                Destination           Protocol Length Info
     65 7.526702       192.168.0.13          3.66.109.246          TCP      54     63840 → 1883 [ACK] Seq=452 Ack=25 Win=131328 Len=0

Frame 65: 54 bytes on wire (432 bits), 54 bytes captured (432 bits)
Ethernet II, Src: LiteonTechno_4d:35:bf (10:63:c8:4d:35:bf), Dst: KaonGroup_51:a2:5c (90:f8:91:51:a2:5c)
Internet Protocol Version 4, Src: 192.168.0.13, Dst: 3.66.109.246
Transmission Control Protocol, Src Port: 63840, Dst Port: 1883, Seq: 452, Ack: 25, Len: 0

No.     Time           Source                Destination           Protocol Length Info
     66 7.698950       3.66.109.246          192.168.0.13          TCP      60     1883 → 63795 [ACK] Seq=454 Ack=37 Win=106 Len=0

Frame 66: 60 bytes on wire (480 bits), 60 bytes captured (480 bits)
Ethernet II, Src: KaonGroup_51:a2:5c (90:f8:91:51:a2:5c), Dst: LiteonTechno_4d:35:bf (10:63:c8:4d:35:bf)
Internet Protocol Version 4, Src: 3.66.109.246, Dst: 192.168.0.13
Transmission Control Protocol, Src Port: 1883, Dst Port: 63795, Seq: 454, Ack: 37, Len: 0

No.     Time           Source                Destination           Protocol Length Info
     67 7.698950       3.66.109.246          192.168.0.13          MQTT     60     Publish Release (id=251)

Frame 67: 60 bytes on wire (480 bits), 60 bytes captured (480 bits)
Ethernet II, Src: KaonGroup_51:a2:5c (90:f8:91:51:a2:5c), Dst: LiteonTechno_4d:35:bf (10:63:c8:4d:35:bf)
Internet Protocol Version 4, Src: 3.66.109.246, Dst: 192.168.0.13
Transmission Control Protocol, Src Port: 1883, Dst Port: 63795, Seq: 454, Ack: 37, Len: 4
MQ Telemetry Transport Protocol, Publish Release

No.     Time           Source                Destination           Protocol Length Info
     68 7.702731       192.168.0.13          3.66.109.246          MQTT     58     Publish Complete (id=251)

Frame 68: 58 bytes on wire (464 bits), 58 bytes captured (464 bits)
Ethernet II, Src: LiteonTechno_4d:35:bf (10:63:c8:4d:35:bf), Dst: KaonGroup_51:a2:5c (90:f8:91:51:a2:5c)
Internet Protocol Version 4, Src: 192.168.0.13, Dst: 3.66.109.246
Transmission Control Protocol, Src Port: 63795, Dst Port: 1883, Seq: 37, Ack: 458, Len: 4
MQ Telemetry Transport Protocol, Publish Complete

No.     Time           Source                Destination           Protocol Length Info
     69 7.897168       KaonGroup_51:a2:5c    LiteonTechno_4d:35:bf ARP      60     Who has 192.168.0.13? Tell 192.168.0.1

Frame 69: 60 bytes on wire (480 bits), 60 bytes captured (480 bits)
Ethernet II, Src: KaonGroup_51:a2:5c (90:f8:91:51:a2:5c), Dst: LiteonTechno_4d:35:bf (10:63:c8:4d:35:bf)
Address Resolution Protocol (request)

No.     Time           Source                Destination           Protocol Length Info
     70 7.897224       LiteonTechno_4d:35:bf KaonGroup_51:a2:5c    ARP      42     192.168.0.13 is at 10:63:c8:4d:35:bf

Frame 70: 42 bytes on wire (336 bits), 42 bytes captured (336 bits)
Ethernet II, Src: LiteonTechno_4d:35:bf (10:63:c8:4d:35:bf), Dst: KaonGroup_51:a2:5c (90:f8:91:51:a2:5c)
Address Resolution Protocol (reply)

No.     Time           Source                Destination           Protocol Length Info
     71 8.001852       3.66.109.246          192.168.0.13          TCP      60     1883 → 63795 [ACK] Seq=458 Ack=41 Win=106 Len=0

Frame 71: 60 bytes on wire (480 bits), 60 bytes captured (480 bits)
Ethernet II, Src: KaonGroup_51:a2:5c (90:f8:91:51:a2:5c), Dst: LiteonTechno_4d:35:bf (10:63:c8:4d:35:bf)
